code,term
253377001,Dilatation of tricuspid annulus
253378006,Overriding tricuspid valve
253379003,Straddling tricuspid valve
253380000,Tricuspid leaflet abnormality
253381001,Absent tricuspid leaflet
253382008,Double orifice of tricuspid valve
253383003,Tricuspid valve prolapse
253384009,Accessory tissue on tricuspid leaflet
253385005,Abnormality of tricuspid chordae tendinae
253386006,Arcade abnormality of tricuspid chordae tendinae
253387002,Tricuspid chordae tendinae too short
253388007,Tricuspid chordae tendinae too long
253389004,Tricuspid chordae tendinae to outlet septum
253390008,Tricuspid papillary muscle abnormality
253391007,Parachute malformation of tricuspid valve
253392000,Absent tricuspid papillary muscle
253393005,Fused tricuspid papillary muscle
253394004,Hypoplastic tricuspid papillary muscle
253395003,Mitral valve dysplasia
253396002,Mitral leaflet dysplasia
253397006,Overriding mitral valve
253398001,Dilatation of mitral annulus
253399009,Straddling mitral valve
253400002,Mitral leaflet abnormality
2534005,Congenital absence of vena cava
253401003,Absent mitral leaflets
253402005,Double orifice of mitral valve
253403000,Ebstein-like downward displacement of mitral valve
253404006,Anterior leaflet of mitral valve attached to septum
253405007,Accessory tissue on mitral leaflet
253406008,Abnormality of mitral chordae tendinae
253407004,Arcade abnormality of mitral chordae tendinae
253408009,Mitral chordae tendinae too short
253409001,Mitral chordae tendinae too long
253410006,Mitral papillary muscle abnormality
253411005,Absent mitral papillary muscle
253412003,Fused mitral papillary muscles
253413008,Hypoplastic mitral papillary muscle
253414002,Atrioventricular septal defect and common atrioventricular junction
253415001,Atrioventricular septal defect - isolated ventricular component
253416000,Atrioventricular septal defect: atrial and ventricular components
253417009,Atrioventricular septal defect - ventricular component
253418004,Atrioventricular septal defect - ventricular component under superior bridging leaflet
253419007,Atrioventricular septal defect with ventricular component under superior bridging leaflet with chords at crest ventricular septum
253420001,Atrioventricular septal defect with ventricular component under superior bridging leaflet with chords to papillary muscle on right ventricular side septum
253421002,Atrioventricular septal defect with ventricular component under free floating superior bridging leaflet and chords to papillary muscle at right ventricular free wall
253422009,Atrioventricular septal defect - ventricular component under inferior bridging leaflet
253423004,Malaligned atrial septum
253425006,Double outlet right atrium
253426007,Double outlet left atrium
253427003,"Abnormality of atrioventricular (non-mitral, non-tricuspid) valve"
253428008,Abnormality of common atrioventricular valve in atrioventricular septal defect
253429000,Atresia of common atrioventricular valve
253430005,Imperforate common atrioventricular valve
253431009,Hypoplasia of common atrioventricular valve
253432002,Dysplasia of common atrioventricular valve
253433007,Regurgitation of common atrioventricular valve
253434001,Common atrioventricular valve limited to one ventricle
253435000,Dilatation of common atrioventricular valve annulus
253436004,Common atrioventricular valve stenosis
253437008,Common atrioventricular valve leaflet abnormality
253438003,Common atrioventricular valve prolapse
253439006,True cleft of common atrioventricular valve leaflet
253440008,Accessory tissue on common atrioventricular valve leaflet
253441007,Double orifice of common atrioventricular valve
253442000,Triple orifice of left ventricular component of common atrioventricular valve
253443005,Ebstein's anomaly of common atrioventricular valve
253444004,Abnormality of common atrioventricular valve chordae tendinae
253445003,Common atrioventricular valve chordae too short
253446002,Common atrioventricular valve chordae too long
253447006,Common atrioventricular valve chordae to outlet septum
253448001,Arcade abnormality of common atrioventricular valve chordae
253449009,Abnormality of common atrioventricular valve papillary muscle
253450009,Parachute malformation of common atrioventricular valve
253451008,Absent common atrioventricular valve papillary muscle
253452001,Fused common atrioventricular valve papillary muscle
253453006,Hypoplastic common atrioventricular valve papillary muscle
253454000,Abnormality of right atrioventricular valve in double inlet ventricle
253455004,Right atrioventricular valve atresia
253456003,Imperforate right atrioventricular valve
253457007,Right atrioventricular valve dysplasia
253458002,Right atrioventricular valve hypoplasia
253459005,Right atrioventricular valve regurgitation
253460000,Overriding right atrioventricular valve
253461001,Dilatation of right atrioventricular valve annulus
253462008,Right atrioventricular valve stenosis
253463003,Straddling right atrioventricular valve
253464009,Right atrioventricular valve leaflet abnormality
253465005,Absent right atrioventricular valve leaflets
253467002,Double orifice of right atrioventricular valve
253468007,Ebstein's anomaly of right atrioventricular valve
253469004,Right atrioventricular valve prolapse
253470003,True cleft of right atrioventricular valve leaflet
253471004,Accessory tissue on right atrioventricular valve leaflet
253472006,Right atrioventricular valve leaflet dysplasia
253473001,Abnormality of right atrioventricular valve chordae tendinae
253474007,Right atrioventricular valve chordae too short
253475008,Right atrioventricular valve chordae too long
253476009,Right atrioventricular valve chordae to outlet septum
253477000,Arcade abnormality of right atrioventricular valve chordae
253478005,Abnormality of right atrioventricular valve papillary muscle
253479002,Parachute malformation of right atrioventricular valve
253480004,Absent right atrioventricular valve papillary muscle
253481000,Fused right atrioventricular valve papillary muscles
253482007,Hypoplastic right atrioventricular valve papillary muscle
253483002,Abnormality of left atrioventricular valve in double inlet ventricle
253484008,Left atrioventricular valve atresia
253485009,Imperforate left atrioventricular valve
253486005,Left atrioventricular valve dysplasia
253487001,Left atrioventricular valve hypoplasia
253488006,Left atrioventricular valve regurgitation
253489003,Overriding left atrioventricular valve
253490007,Dilatation of left atrioventricular valve annulus
253491006,Left atrioventricular valve stenosis
253492004,Straddling left atrioventricular valve
253493009,Left atrioventricular valve leaflet abnormality
253494003,Absent left atrioventricular valve leaflets
253495002,Double orifice of left atrioventricular valve
253496001,Ebstein's anomaly of left atrioventricular valve
253497005,Left atrioventricular valve prolapse
253498000,True cleft of left atrioventricular valve leaflet
253499008,Accessory tissue on left atrioventricular valve leaflet
253500004,Left atrioventricular valve leaflet dysplasia
253501000,Abnormality of left atrioventricular valve chordae tendinae
253502007,Left atrioventricular valve chordae too short
253503002,Left atrioventricular valve chordae too long
253504008,Left atrioventricular valve chordae to outlet septum
253505009,Arcade abnormality of left atrioventricular valve chordae
253506005,Abnormality of left atrioventricular valve papillary muscle
253507001,Parachute malformation of left atrioventricular valve
253508006,Absent left atrioventricular valve papillary muscle
253509003,Fused left atrioventricular valve papillary muscles
253510008,Hypoplastic left atrioventricular valve papillary muscle
253511007,Congenital abnormality of ventricles and ventricular septum
253512000,Tetralogy of Fallot with pulmonary stenosis
253513005,Tetralogy of Fallot with pulmonary atresia
253514004,Dextraposition of aorta in Fallot's tetralogy
253515003,Ventricular septal defect in Fallot's tetralogy
253516002,Right ventricular abnormality
253518001,Diffuse hypoplasia of right ventricle
253519009,Hypoplasia of right ventricular inflow tract
253520003,Hypoplasia of right ventricular outflow tract
253521004,Hypoplasia of right ventricular outflow tract and trabecular area
253522006,Dilatation of right cardiac ventricle
253523001,Primary right ventricular endocardial fibroelastosis
253524007,Two chambered right ventricle
253525008,Congenital right ventricular diverticulum
253527000,Congenital right ventricular aneurysm
253528005,Arrhythmogenic right ventricular dysplasia
253529002,Right ventricular outflow tract abnormality
253530007,Right ventricular outflow tract obstruction
253531006,Right ventricular outflow obstruction - localized
253532004,Right ventricular outflow obstruction - tubular
253533009,Right ventricular outflow tract atresia
253534003,Right ventricular outflow tract absent
253535002,Left ventricular abnormality
253536001,Left ventricular hypoplasia
253537005,Diffuse hypoplasia of left ventricle
253538000,Hypoplasia of left ventricular inflow tract
253539008,Hypoplasia of left ventricular outflow tract
253540005,Hypoplasia of left ventricular outflow tract and trabecular area
253541009,Dilatation of left cardiac ventricle
253542002,Abnormal left ventricular muscle band
253543007,Primary left ventricular endocardial fibroelastosis
253544001,Congenital left ventricular aneurysm
253545000,Left ventricular outflow tract abnormality
253546004,Left ventricular outflow tract obstruction
253547008,Left ventricular outflow tract atresia
253548003,Indeterminate ventricular outflow tract obstruction
253549006,Ventricular septal abnormality
253550006,Multiple ventricular septal defects
253551005,Restrictive ventricular septal defect
253552003,Perimembranous ventricular septal defect with extension to right ventricular inlet
253553008,Perimembranous ventricular septal defect with extension to right ventricular trabecular component
253554002,Perimembranous ventricular septal defect with extension to right ventricular outlet
253555001,Perimembranous ventricular septal defect with extension to all right ventricular components
253556000,Ventricular septal defect with malaligned outlet septum to right
253559007,Ventricular septal defect with malaligned outlet septum to left
253562005,Ventricular septal defect with absent outlet septum and overriding truncal valve
253563000,Muscular ventricular septal defect in inlet septum
253564006,Muscular ventricular septal defect in central trabecular septum
253565007,Muscular ventricular septal defect in apical trabecular septum
253566008,Muscular ventricular septal defect in marginal septum
253567004,Muscular ventricular septal defect in outlet septum
253568009,Doubly committed subarterial ventricular septal defect
253569001,Doubly committed subarterial ventricular septal defect with membranous septum extension
253570000,Doubly committed subarterial ventricular septal defect with muscular posterior inferior rim
253571001,Giant ventricular septal defect
253573003,Subpulmonary infundibulum
253574009,Subaortic infundibulum
253575005,Bilateral muscular infundibula
253576006,Bilateral deficient infundibula
253577002,Ventricular septal aneurysm
253578007,Congenital abnormality of arterial valves
253579004,Truncal valve abnormality
253580001,Truncal valve dysplasia
253581002,Truncal valve stenosis
253582009,Truncal valve regurgitation
253583004,Truncal valve prolapse
253584005,Accessory tissue on truncal valve cusp
253585006,Pulmonary valve cusp hypoplasia
253586007,Pulmonary valve ring hypoplasia
253587003,Commissural fusion of pulmonary valve
253588008,Pulmonary valve dysplasia
253590009,Pulmonary atresia with intact ventricular septum
253591008,Pulmonary atresia with ventricular septal defect
253592001,Pulmonary valve atresia without ventricular outflow tract
253593006,Imperforate pulmonary valve
253594000,Muscular pulmonary atresia
253595004,Pulmonary valve prolapse
253596003,Absent pulmonary valve syndrome
253597007,Accessory tissue on pulmonary valve cusp
253598002,Unicuspid pulmonary valve
253599005,Bicuspid pulmonary valve
253600008,Quadricuspid pulmonary valve
253601007,Aortic valve ring hypoplasia
253602000,Commissural fusion of aortic valve
253603005,Eccentric opening of aortic valve
253604004,Aortic valve dysplasia
253606002,Aortic valve cusp abnormality
253607006,Hypoplasia of aortic valve cusp
253608001,Accessory tissue on aortic valve cusp
253609009,Abnormal number of aortic valve cusps
253610004,Unicuspid aortic valve
253611000,Quadricuspid aortic valve
253612007,Aortic valve cusp prolapse
253614008,Tubular hypoplasia of aorta
253615009,Anomalies of the aorta excluding coarction
253620009,Pulmonary trunk abnormality
253621008,Pulmonary trunk stenosis
253622001,Pulmonary trunk hypoplasia
253623006,Pulmonary trunk atresia
253624000,Pulmonary atresia with confluent pulmonary arteries
253625004,Pulmonary atresia with absent pulmonary artery
253627007,Pulmonary trunk absent with confluent pulmonary arteries
253628002,Pulmonary trunk absent with non-confluent pulmonary arteries
253629005,Pulmonary trunk absent with absent pulmonary artery
253630000,Pulmonary trunk dilatation
253631001,Peripheral pulmonary artery stenosis
253632008,Abnormal origin of right pulmonary artery
253633003,Anomalous origin of right pulmonary artery from ductus arteriosus
253634009,Anomalous origin of right pulmonary artery from ascending aorta
253635005,Abnormal origin of left pulmonary artery
253636006,Anomalous origin of left pulmonary artery from ductus arteriosus
253637002,Anomalous origin of left pulmonary artery from ascending aorta
253638007,Anomalous origin of left pulmonary artery from right pulmonary artery
253640002,Ascending aorta abnormality
253641003,Localized supravalvar aortic stenosis
253642005,Diffuse supravalvar aortic stenosis
253643000,Ascending aortic atresia
253644006,Ascending aorta absent
253645007,Ascending aorta dilatation
253646008,Congenital aneurysm of ascending aorta
253647004,Sinus of Valsalva abnormality
253648009,Sinus of Valsalva aneurysm with rupture
253649001,Aortic tunnel
253650001,Aorta to right ventricle tunnel
253651002,Aortic arch and descending aorta abnormality
253652009,Right descending aorta
253653004,Left aortic arch and right descending aorta
253654005,Right aortic arch and right descending aorta
253655006,Right aortic arch and left descending aorta
253656007,Aortic arch centrally descending
253657003,Cervical aortic arch
253658008,Persisting fifth aortic arch
253660005,Double aortic arch with both patent
253663007,Vascular ring with left aortic arch
253664001,Vascular ring with right aortic arch
253667008,Aberrant retroesophageal brachiocephalic artery
253668003,Isolation of subclavian artery
253669006,Ductus arteriosus from subclavian artery
253670007,Ductus arteriosus from retroesophageal aortic diverticulum
253672004,Preductal aortic stenosis
253673009,Preductal interruption of aorta
253674003,Preductal hypoplasia of aorta
253675002,Juxtaductal aortic coarctation
253676001,Postductal aortic stenosis
253677005,Postductal interruption of aorta
253678000,Thoracic aortic coarctation
253679008,Abdominal aortic coarctation
253680006,Postductal hypoplasia of aorta
253681005,Interrupted aortic arch distal to left subclavian artery
253682003,Interrupted aortic arch between left subclavian and left common carotid artery
253683008,Interrupted aortic arch between left common carotid and brachiocephalic artery
253685001,Patent ductus arteriosus - delayed closure
253687009,Abnormal origin of ductus arteriosus
253688004,Collaterals to pulmonary arteries
253689007,Major aortopulmonary collateral artery
253690003,Systemic to pulmonary collateral artery
253691004,Stenosis of systemic to pulmonary artery collateral artery
253692006,Bronchopulmonary collateral artery
253693001,Congenital abnormalities of thoracic aortic branches
253695008,Abnormality of aortic arch branch
253696009,Distal origin of brachiocephalic trunk
253697000,Isolation of branch of aortic arch
253698005,Isolation of brachiocephalic trunk
253699002,Isolation of common carotid artery
253700001,Variant coronary origin from aortic sinus
253703004,Anomalous origin of coronary artery from non-facing sinus
253704005,Anomalous origin of left anterior descending from right coronary artery
253706007,Anomalous origin of coronary artery from pulmonary arterial tree
253707003,Anomalous origin of coronary artery from right pulmonary artery
253708008,Anomalous origin of coronary artery from left pulmonary artery
253710005,Coronary orifice abnormally high
253711009,Coronary orifice asymmetrical
253712002,Dual coronary orifice
253714001,Abnormal coronary artery course
253715000,Intramural coronary artery course
253716004,Aberrant course of left anterior descending coronary artery from right coronary artery crossing right ventricular outflow tract
253717008,Coronary artery runs between aorta and pulmonary trunk
253718003,Circumflex runs posterior to pulmonary trunk
253719006,Circumflex runs posterior to aorta
253720000,Congenital coronary arteriovenous fistula
253721001,Single coronary artery fistula
253722008,Multiple coronary artery fistulae
253723003,Coronary fistulae from right ventricle
253724009,Coronary fistulae from left ventricle
253725005,Congenital coronary artery calcification
253726006,Right ventricle-dependent coronary circulation
253727002,Variant dominance of coronary circulation
253728007,Right dominant coronary system
253729004,Left dominant coronary system
253730009,Balanced coronary system
253731008,Partial agenesis of pericardium
253732001,Totally absent pericardium
253733006,Pleuropericardial cyst
253734000,Pericardial diverticulum
25380002,Pericarditis co-occurrent and due to systemic lupus erythematosus
25412000,Microaneurysm of retinal artery due to diabetes mellitus
254206003,Congenital vascular nevus
254207007,Reticulate vascular nevus
254208002,Nevus sanguineous
254209005,Mixed hemangioma
254211001,Salmon patch nevus
254757003,Extracellular cholesterosis
254774003,Cobb's syndrome
254775002,Bregeat's syndrome
254776001,Multiple angiomatous nevi of skin
254778000,Congenital livedo reticularis
254780006,Arteriovenous malformation of skin
254782003,Multiple progressive hemangiomata
254784002,Blue rubber bleb nevus
254787009,Verrucous hemangioma of skin
254788004,Angiokeratoma of skin
254790003,Targetoid hemosiderotic hemangioma
254826008,Benign mesothelioma of pericardium
254997007,Capillary hemangioma of orbit
25503004,Pneumopyopericardium
2554006,Acute purulent pericarditis
25544003,Low output heart failure
25559009,Congenital absence of left pulmonary artery
25569003,Ventricular tachycardia
25772007,Multi-infarct dementia with delusions
257812009,Chronic peri-aortitis
2583009,Chiari's network
25878000,Aneurysm of hepatic artery
25971000119100,Vascular birthmark
25981000119102,Venous thoracic outlet syndrome
26078007,Hypertension secondary to renal disease complicating AND/OR reason for care during childbirth
26117009,Diphtheritic myocarditis
261195002,Circulatory arrest
26146002,Complete transposition of great vessels
261482004,Spinal arteriovenous malformation
26150009,Lower half migraine
26201005,Aortic left ventricular tunnel
26214006,Thrombosis of retinal artery
262715008,Injury of spinal cord vasculature
262716009,Injury of anterior spinal artery
262717000,Injury of vertebral artery
262782002,Laceration of heart
262937009,Injury to blood vessel of neck
262939007,Transection of artery
262940009,Transection of vertebral artery
262941008,Transection of coronary artery
262942001,Transection of carotid artery
262943006,Transection of aorta
262944000,Transection of anterior spinal artery
262945004,Transection of transplanted artery
262947007,Aneurysm of transplanted vein
26373009,Thrombosed external hemorrhoids
263944006,Anterolateral muscle band
263961009,Bilateral isomeric atria
264086008,Malaligned outlet septum
264162009,Posteromedial muscle band
26421009,Bleeding external hemorrhoids
264258007,Persistent vertical vein
264467005,False tendon - heart
264503005,Aneurysm of membranous septum
264557003,Ovarian vein syndrome
264571006,Septoparietal trabeculations
266235007,Acute idiopathic pericarditis
266237004,Acute and subacute bacterial endocarditis
266238009,Isolated (Fiedler's) myocarditis
266249003,Ventricular hypertrophy
266250003,Mitral papillary muscle rupture
266252006,Mitral papillary muscle dysfunction
266253001,Precerebral arterial occlusion
266254007,Occlusion of carotid artery
266257000,Transient ischemic attack
266262004,Arterial embolus and thrombosis
266263009,Embolism and thrombosis of the abdominal aorta
266272001,Vulval varices - non-obstetric
266329009,Simple varicose veins
266330004,Ruptured varicose veins
266519001,Acute gastrointestinal tract vascular insufficiency
266520007,Chronic gastrointestinal tract vascular insufficiency
26660001,Dilatation of aorta
267207004,"Congenital cardiovascular disorders during pregnancy, childbirth and the puerperium"
267280004,Venous complication of pregnancy and/or the puerperium
267282007,Varicose veins of perineum and vulva in pregnancy and the puerperium
267283002,Superficial thrombophlebitis in pregnancy and the puerperium - delivered with postnatal complication
267284008,Obstetric pyemic and septic pulmonary embolism
26743002,Illegal abortion complicated by embolism
26780008,Coarctation of pulmonary artery
268174004,Bulbus cordis and cardiac septal closure anomalies
268180007,Right hypoplastic heart syndrome
268184003,Hypoplasia of aorta
268185002,Supravalvar aortic stenosis
268187005,Congenital pulmonary artery aneurysm
268190004,Congenital peripheral aneurysm
268284006,Vascular hamartomas
26850007,Phlebitis AND/OR thrombosis complicating pregnancy AND/OR puerperium
26865008,Congenital absence of superior vena cava
26900001,Coronary ostium stenosis
269299003,Cardiac insufficiency as a complication of care
269438006,Bypass graft mechanical complications
269451001,Air embolism - postoperative
26950008,Chronic ectopic atrial tachycardia
26954004,Thrombophlebitis of superior sagittal sinus
27007008,Scarring of papillary muscle
27012009,Hyperkinetic heart disease
27015006,Legal abortion with amniotic fluid embolism
27017003,Chronic effusive pericarditis
270492004,First degree atrioventricular block
270510008,Anomalous coronary artery communication
270512000,Pulmonary arteriovenous aneurysm
270906004,Mitral chordae rupture
27097002,Danish type familial amyloid cardiomyopathy
271376002,Air embolism
271432005,Congenital renal artery stenosis
271547004,Stokes-Adams attack
271573009,Congenital abnormality of thoracic aorta and pulmonary arteries
271594007,Syncope
271870002,Low blood pressure reading
271967002,Disorder of vena cava umbrella
271984008,Disorder of prosthetic cardiac valve
271985009,Disorder of intra-aortic pulsation balloon
271990007,Vascular graft avulsion
272202251000119109,Acute cerebrovascular accident due to occlusion of right middle cerebral artery
27277001,Tophus of heart co-occurrent and due to gout
27337007,Unifocal premature ventricular complexes
274097009,Non-rheumatic heart valve disorder
274098004,Rupture of chordae tendineae
274101000,Aortic thromboembolism
274119009,Rubella in pregnancy
274121004,Cardiac disease in pregnancy
274947007,Divided right atrium
275359008,Umbilical hemorrhage
275363001,Rupture of superficial cerebral vein
275434003,Stroke in the puerperium
275446004,Gardner-Diamond syndrome
27550009,Disorder of blood vessel
275510005,Acquired renal arteriovenous aneurysm
275513007,Viral pericarditis - virus unidentified
275516004,Cardiomegaly - hypertensive
275517008,Superficial vein thrombosis
275518003,Perineal varices
275519006,Peripheral arteriovenous malformation
275521001,Blue baby
275700003,Varicose veins of the leg with eczema
276220007,Foville syndrome
276221006,Millard-Gubler syndrome
27631000146108,Dissection of aortic arch
27637000,Dextrocardia
276392006,Pile easily reducible
276393001,Pile reducible with difficulty
276394007,Prolapsed pile irreducible
276475003,Avulsion of vein - injury
276500007,Mesenteric embolus
27651000146102,Dissection of descending aorta
276510003,Perinatal cardiovascular disorders
276512006,Fetal dysrhythmia
276513001,Neonatal dysrhythmia
276514007,Neonatal cardiac failure
276516009,Myocardial ischemia of newborn
276517000,Transient myocardial ischemia of newborn
276518005,Transient tricuspid regurgitation of newborn
276519002,Neonatal hypotension
276537001,Chronic pulmonary insufficiency of prematurity
276594006,Perinatal rupture of superficial cerebral vein
276620002,Traumatic neonatal facial cyanosis
276622005,Epicranial subaponeurotic hemorrhage
276667003,Venous air embolism
276697006,Harlequin change
276706004,Perinatal cerebral ischemia
276741000,Sepsis-associated myocardial dysfunction
276790000,Isolated aortic stenosis
276792008,Pulmonary hypertension with extreme obesity
276793003,Pulmonary hypertension with occult mitral stenosis
276794009,Facultative pulmonary hypertension with shunt at atrial level
276795005,Mitral valve anterior leaflet prolapse
276796006,Atrial tachycardia
277196008,Berry aneurysm
277198009,Atherosclerotic aneurysm
277299009,Ruptured cerebral arteriovenous malformation
277301002,Ruptured spinal arteriovenous malformation
277315000,Ruptured aneurysm of anterior cerebral artery
277316004,Ruptured aneurysm of middle cerebral artery
277319006,Ruptured aneurysm of posterior cerebral artery
277320000,Ruptured aneurysm of anterior communicating artery
277322008,Ruptured aneurysm of posterior communicating artery
277324009,Ruptured aneurysm of basilar artery
277325005,Ruptured aneurysm of posterior inferior cerebellar artery
277328007,Ruptured internal carotid-anterior communicating artery zone aneurysm
277329004,Ruptured internal carotid-posterior communicating artery zone aneurysm
277330009,Ruptured internal carotid bifurcation aneurysm
