code,term
441739009,Disorder of vein of lower extremity
442105001,Septic embolus of artery
442224005,Arteriosclerosis of autologous vein coronary artery bypass graft
442240008,Arteriosclerosis of nonautologous coronary artery bypass graft
442267002,Angiodysplasia of duodenum
442298000,Fracture of stent of coronary artery
44241007,Heart valve stenosis
442421004,Arteriosclerosis of arterial coronary artery bypass graft
442439008,Atherosclerosis of bypass graft of limb
442559009,Bundle branch reentrant ventricular tachycardia
442693003,Atherosclerosis of autologous vein bypass graft of limb
442701004,Atherosclerosis of nonautologous biological bypass graft of limb
442735001,Atherosclerosis of nonautologous bypass graft of limb
442917000,Congenital long QT syndrome
442946007,Acquired long QT syndrome
443089001,Pseudoaneurysm
443095000,Hemicrania continua
44313006,Right heart failure secondary to left heart failure
443210003,Deep venous thrombosis of peroneal vein
443253003,Acute on chronic systolic heart failure
443254009,Acute systolic heart failure
443264000,Arteriovenous fistula of right upper extremity
443343001,Acute diastolic heart failure
443344007,Acute on chronic diastolic heart failure
443379009,Functional single ventricle
443414005,Cor bovinum
443478002,Heart block caused by drug
443482000,Hypertensive urgency
443502000,Atherosclerosis of coronary artery
443762000,Hypertrophic cardiomegaly
443770005,Arteriovenous fistula of left upper extremity
443904006,Corona phlebectatica
443929000,Small vessel cerebrovascular disease
443971004,Arteriosclerosis of artery of extremity
444036008,Injury of aorta
444172003,Recurrent transient cerebral ischemic attack
444325005,Deep vein thrombosis of bilateral lower extremities
44437005,Thrombosis of corpus cavernosum
444549009,Embolism from thrombosis of vein of thigh
444569004,Aneurysm of infrarenal abdominal aorta
444605001,Symptomatic sinus bradycardia
444657001,Superior cerebellar artery syndrome
444658006,Nonsustained ventricular tachycardia
444718001,Bilateral enlargement of atria
444744001,Hypothenar hammer syndrome
444816006,Embolism from thrombosis of vein of lower extremity
444819004,Polyarteritis of kidney
444851003,Bifid apex of heart
444855007,Arteriosclerosis of coronary artery bypass graft of transplanted heart
444856008,Arteriosclerosis of internal mammary artery coronary artery bypass graft
444869007,Cavernous hemangioma of brain
444961009,Atrioventricular septal defect with common atrioventricular orifice
445001003,Left ventricular outflow tract obstruction due to malaligned outlet septum
445002005,Atrioventricular septal defect with separate atrioventricular orifices
445003000,Left ventricular outflow tract obstruction due to subpulmonary fibromuscular shelf
445027003,Left superior caval vein persisting to coronary sinus
445106006,Congenital dilation of left pulmonary artery
445109004,Isolation of left common carotid artery
445131007,Left ventricular outflow tract obstruction due to fibromuscular tunnel
445167000,Congenital dilation of right pulmonary artery
445176007,Congenital dilation of ascending aorta
445208002,Congenital hypoplasia of right pulmonary artery
445209005,Congenital hypoplasia of left pulmonary artery
445222002,Accidental puncture of artery during catheter insertion
445235006,Left ventricular outflow tract obstruction due to anterolateral muscle band
445236007,Cardiorenal syndrome
445237003,Portopulmonary hypertension
445264002,Atrioventricular septal defect with ventricular imbalance consisting of dominant left ventricle and hypoplastic right ventricle
445268004,Apex of heart anterior to cardiac base
445270008,Aortic orifice left side by side with respect to pulmonary orifice
445284003,Aortic sinus of Valsalva aneurysm from noncoronary sinus
445285002,Aortic sinus of Valsalva aneurysm from left coronary sinus
445286001,Aortic sinus of Valsalva aneurysm from right coronary sinus
445294008,Common atrioventricular orifice in double inlet ventricle
445296005,Infracardiac location of anomalous pulmonary venous connections to portal system
445298006,Aortic orifice anterior with respect to pulmonary orifice
445299003,Atrioventricular septal defect with ventricular imbalance consisting of dominant right ventricle and hypoplastic left ventricle
445305001,Cavernous hemangioma of skin
445310002,Left ventricular outflow tract obstruction due to diaphragm
445322004,Migraine variant with headache
445330003,Right atrioventricular valve leaflets absent in double inlet ventricle (unguarded orifice)
445334007,Atrioventricular septal defect with additional muscular ventricular septal defect
445349004,Isolation of right common carotid artery
445350004,Isolation of left subclavian artery
445351000,Isolation of right subclavian artery
445371009,Infracardiac location of anomalous pulmonary venous connections to inferior caval vein
445373007,Aortic orifice posterior with respect to pulmonary orifice
445435009,Apex of heart posterior to cardiac base
445436005,Left superior caval vein persisting to left sided atrium
445440001,Right ventricular aneurysm
445453003,Left ventricular outflow tract obstruction due to aneurysm of membranous septum
445454009,Left ventricular outflow tract obstruction due to atrioventricular valve
445486004,Congenital malformation of blood vessel of orbit proper
445512009,Calcification of coronary artery
445535007,Syncope witnessed by provider of history other than subject
445539001,Right ventricular diverticulum
445540004,Left ventricular diverticulum
445543002,Intracardiac location of anomalous pulmonary venous connections to bilateral isomeric atriums
445607003,Aortic orifice posterior left with respect to pulmonary orifice
445636003,Aortic orifice anterior right with respect to pulmonary orifice
445650008,Aortic orifice anterior left with respect to pulmonary orifice
445874008,Traumatic rupture of gastroepiploic artery
445898001,Abnormal atrial arrangement
445928005,Eisenmenger's syndrome
44595001,Mycotic pericarditis
44602002,Persistent sinus bradycardia
446029009,Traumatic injury of blood vessel of head
446140003,Laceration of anterior tibial artery
44622003,Congenital hypoplasia of umbilical artery
446221000,Heart failure with normal ejection fraction
44630002,Dilated cardiomyopathy secondary to fungal myocarditis
446326008,Premature restriction of foramen ovale
446358003,Right atrial hypertrophy
446432002,Pulmonary venous hypoplasia
446465005,Traumatic rupture of mesenteric vessel
44647001,Persistent hyaloid artery
446558004,Perforation of femoral artery
446628002,Tricuspid leaflet gelatinous
446630000,Tricuspid leaflet noncoapting
446633003,Tricuspid leaflet thickened
446655006,Systemic vein obstruction
446657003,Criss-cross heart with rightward rotation
446659000,Ventricular imbalance with dominant left ventricle and hypoplastic right ventricle
446667008,Two atrioventricular valves in double inlet ventricle
446668003,Obstructed pulmonary venous connection due to extrinsic compression
446670007,Aortic orifice right side by side with respect to pulmonary orifice
446699002,Tricuspid leaflet deficiency
446712002,Thromboembolus of precerebral artery
446781004,Tricuspid leaflet flail
446786009,Tricuspid leaflet fenestration
446813000,Left atrial hypertrophy
446836009,Traumatic injury of mesenteric artery
446890001,Obstructed pulmonary venous connection at coronary sinus orifice
446909006,Midline apex of heart
446916007,Functionally univentricular heart
447110008,Laceration of ulnar artery
447111007,Dieulafoy vascular malformation of stomach
447260005,Traumatic injury of celiac artery
447269006,Persistent common pulmonary vein
447274003,Obstructed pulmonary venous connection due to intrinsic narrowing
447275002,Alveolar capillary dysplasia with pulmonary venous misalignment
447283008,Solitary ventricle of indeterminate morphology
447284002,Double outlet right ventricle with intact ventricular septum
447285001,Ventricular imbalance
447286000,Ventricular imbalance with dominant right ventricle and hypoplastic left ventricle
447289007,Criss-cross heart with leftward rotation
4473006,Migraine with aura
447318008,Obstructed pulmonary venous connection at interatrial communication
447322003,Laceration of radial artery
447348006,Laceration of posterior tibial artery
447418009,Laceration of digital artery of hand
447498008,Obstructed pulmonary venous connection due to extrinsic compression between right pulmonary artery and trachea
447528003,Obstructed pulmonary venous connection due to extrinsic compression at diaphragm
447571007,Obstructed pulmonary venous connection due to extrinsic compression between left pulmonary artery and bronchus
447660003,Retroaortic brachiocephalic vein
447661004,Diverticulum of coronary sinus
447663001,Pulmonary venous confluence remote from left atrium
447664007,Partial anomalous pulmonary venous connection of part of left lung
447665008,Interatrial communication through coronary sinus orifice
447666009,Divided left atrium with all pulmonary veins to proximal chamber and then to left atrium
447667000,Divided left atrium with all pulmonary veins to proximal chamber without communication to left atrium
447668005,Discontinuous pulmonary arteries
447669002,Hypoplasia of left heart without intrinsic valve stenosis and without atresia
447670001,Ventricular septal defect with anterior malaligned outlet septum with overriding pulmonary valve
447671002,Ventricular septal defect with posterior malaligned outlet septum with overriding aortic valve
447672009,Ventricular septal defect with posterior malaligned outlet septum with overriding pulmonary valve
447673004,Right ventricle to left of left ventricle
447681003,Continuity between mitral valve and pulmonary valve
447682005,Discontinuity between mitral valve and aortic valve
447683000,Discontinuity between mitral valve and pulmonary valve
447689001,Prolapse of Eustachian valve through atrial septum
447690005,Prolapse of Eustachian valve through tricuspid valve
447691009,Pulmonary venous confluence in direct proximity to left atrium
447695000,Tricuspid truncal valve
447696004,Unicommissural unicuspid aortic valve
447697008,Unicommissural unicuspid pulmonary valve
447698003,Ventricular septal defect with anterior malaligned outlet septum with overriding aortic valve
447700007,Distal aortopulmonary window with minimal superior rim
447701006,Intermediate aortopulmonary window with adequate superior and inferior rim
447702004,Confluent aortopulmonary window with minimal superior and inferior rim
447703009,Double aortic arch with left arch dominant and coarctation of right arch
447772003,Persisting fifth aortic arch with double barrell arch
447773008,Proximal aortopulmonary window with minimal inferior rim
447774002,Congenital midvalvar ring of mitral leaflet
447779007,Trifoliate left atrioventricular valve
447780005,Restrictive interatrial communication with obligatory shunt
447812003,Left superior vena cava persisting to right atrium and left atrium
447813008,Pulmonary venous confluence in horizontal orientation
447814002,Pulmonary venous confluence in vertical orientation
447817009,Obstruction of aortic arch
447822009,Congenital prolapse of aortic valve
447823004,Congenital abnormality of hepatic vein
447824005,Congenital abnormality of left atrium
447825006,Congenital abnormality of middle cardiac vein
447827003,Partial anomalous pulmonary venous connection of entire right lung
447829000,Congenital abnormality of tricuspid chordae tendinae
447830005,Congenital abnormality of tricuspid leaflet
447832002,Total anomalous pulmonary venous connection of supracardiac type
447838003,Pulmonary atresia and ventricular septal defect with aorta from left ventricle
447839006,Pulmonary atresia and ventricular septal defect with aorta from right ventricle
447840008,Stenosis of right pulmonary artery
447845003,Right ventricle posterior to left ventricle
447846002,Obstruction of ascending aorta
447847006,Prolapse of right coronary aortic valve cusp
447849009,Double aortic arch with right arch dominant and atresia of left arch
447850009,Double aortic arch with right arch dominant and coarctation of left arch
447852001,Ventricular septal defect of inlet of right aspect of ventricular septum
447860000,Partial anomalous pulmonary venous connection of part of right lung
447861001,Partial anomalous pulmonary venous connection with anomalous veins connecting first to pulmonary venous confluence
447874007,Congenital abnormality of atrial septum
447875008,Congenital mass of mitral leaflet
447876009,Congenital aneurysm of subaortic left ventricle
447901004,Aortopulmonary window with tubular connection
447902006,Atresia of left superior vena cava
447903001,Coarctation of right pulmonary artery
447913009,Completely unroofed coronary sinus defect in left atrium
447914003,Total anomalous pulmonary venous connection of intracardiac type
447915002,Ebstein's anomaly of left sided tricuspid valve with discordant atrioventricular connections
447919008,Univentricular atrioventricular connection with absent right sided atrioventricular connection
447923000,Thin cardiac ventricular septum
447924006,Tortuosity of pulmonary artery
447925007,Hypoperfusion of left pulmonary artery due to preferential flow to right pulmonary artery
447926008,Hypoperfusion of right pulmonary artery due to preferential flow to left pulmonary artery
447927004,Saccular dilatation of left superior vena cava
447928009,Double aortic arch with balanced arches
447929001,Double aortic arch with left arch dominant
447930006,Double aortic arch with right arch dominant
447932003,Double outlet ventriculoarterial connections
447933008,Nonfenestrated interatrial communication within oval fossa
447934002,Right ventricular myocardial noncompaction cardiomyopathy
447935001,Left ventricular myocardial noncompaction cardiomyopathy
447937009,Congenital abnormality of aortic valve cusp
447938004,Congenital abnormality of cardiac vein
447939007,Partial anomalous pulmonary venous connection of entire left lung
447941008,Residual ventricular septal defect
447943006,Tripartite right ventricle
447962009,Divided left atrium with restrictive outlet of proximal chamber to left atrium
447968008,Descending aorta anterior and same side as azygos vein with azygos continuity of inferior vena cava
447970004,Double aortic arch with left arch dominant and atresia of right arch
447988007,Common arterial trunk with pulmonary arteries arising from trunk and unobstructed aortic arch
447997006,Vascular ring with retrotracheal right pulmonary artery from ascending aorta
447998001,Single ventricular outlet above right ventricle
447999009,Single ventricular outlet above left ventricle
448000003,Right superior vena cava connecting to left atrium and right atrium
448001004,Right ventricular outflow tract obstruction due to aneurysm of membranous septum
448004007,Acommissural unicuspid pulmonary valve
448005008,Atresia of systemic vein
448007000,Atrioventricular septal defect associated with tetralogy of Fallot
448016001,Congenital aneurysm of systemic artery
448026008,Left atrioventricular valve bifoliate with fused left sided superior and inferior bridging leaflet
448027004,Supravalvar pulmonary trunk stenosis
448028009,Congenital left ventricular submitral valve aneurysm
448059006,Pulmonary trunk absent with absent left pulmonary artery
448060001,Pulmonary trunk absent with absent right pulmonary artery
448061002,Shelf-like supravalvar aortic stenosis
448062009,Ventricular septal defect with malaligned outlet septum
448063004,Congenital abnormality of posterior cardiac vein of left ventricle
448064005,Congenital abnormality of right atrium
448065006,Congenital abnormality of systemic vein
448066007,Divided left atrium with nonrestrictive outlet of proximal chamber to left atrium
448067003,Recoarctation of aorta
448072007,Single inlet ventricle with absent atrioventricular connection
448073002,Congenital abnormality of tricuspid papillary muscle
448074008,Ebstein's anomaly with functional tricuspid stenosis
448075009,Uniatrial biventricular connection with absent right sided atrioventricular connection with straddling valve
448078006,Vascular ring with right aortic arch and right arterial ligament with absent left pulmonary artery
448079003,Vascular ring with right aortic arch and right patent arterial duct with absent left pulmonary artery
448080000,Single ventricular outlet above ventricle of indeterminate morphology
44808001,Conduction disorder of the heart
448081001,Hepatic vein to coronary sinus
448082008,Right ventricular outflow tract obstruction due to prolapse of Eustachian valve
448083003,Right ventricular outflow tract obstruction due to prolapsed arterial valve
448084009,Absent pulmonary trunk
448085005,Acommissural unicuspid aortic valve
448086006,Atresia of pulmonary trunk with absent left pulmonary artery
448087002,Atresia of pulmonary trunk with absent right pulmonary artery
448092000,Vascular ring due to aberrant subclavian artery and bilateral arterial ducts
448095003,Aortic left ventricular tunnel with right coronary artery from tunnel
448096002,Aberrant origin of left subclavian artery
448097006,Abnormal course of aortic arch
448098001,Aneurysm of aortic sinus of Valsalva with protrusion into pulmonary artery
448099009,Aneurysm of aortic sinus of Valsalva with protrusion into right atrium
448100001,Aneurysm of aortic sinus of Valsalva with protrusion into right ventricle
448102009,Quadricuspid truncal valve
448103004,Right ventricle inferior to left ventricle
448104005,Localized supravalvar aortic stenosis at sinutubular junction
448105006,Anomalous origin of pulmonary artery from patent arterial duct
448113007,Right superior vena cava connecting to coronary sinus
448115000,Aneurysm of aortic sinus of Valsalva with protrusion into left atrium
448116004,Aneurysm of aortic sinus of Valsalva with protrusion into left ventricle
448117008,Aneurysm of aortic sinus of Valsalva with protrusion into pericardial cavity
448118003,Atrioventricular septal defect with atrial and ventricular components and separate atrioventricular valves
448119006,Atrioventricular septal defect with atrioventricular valve regurgitation
448120000,Common arterial trunk with crossed over pulmonary arteries
448153005,Vascular ring with left aortic arch and right arterial duct arising from aberrant retroesophageal right subclavian artery
448154004,Vascular ring with left aortic arch and right arterial duct arising from retroesophageal aortic diverticulum
448155003,Pulmonary atresia with ventricular septal defect of Fallot type
448157006,Abnormality of systemic vein
448158001,Abnormality of thoracoabdominal aorta
448159009,Abnormality of tricuspid subvalvar apparatus
448161000,Aortic valve overriding ventricular septum
448162007,Bipartite right ventricle
448179001,Aneurysm of right superior vena cava
448180003,Aneurysm of systemic vein
448181004,Anomalous coronary venous return
448182006,Atrioventricular septal defect with ventricular component and interchordal shunting under inferior bridging leaflet
448183001,Atrioventricular septal defect with ventricular component and interchordal shunting under superior bridging leaflet
448184007,Atrioventricular septal defect with ventricular component and shunting under connecting tongue with separate orifices
448208003,Nonrestrictive interatrial communication
448277007,Midline posterior apex of heart
448278002,Coronary sinus drainage cephalad to left superior vena cava
448280008,Malalignment of aortic sinus in relation to pulmonary sinus
448281007,Abnormality of hepatic vein
448303009,Vascular ring with left aortic arch to right descending aorta and right arterial ligament
448304003,Vascular ring with left aortic arch to right descending aorta and right patent arterial duct
448305002,Vascular ring with malrotation and dextroversion of heart and hypoplasia of right lung and left arterial duct
448308000,Right ventricular outflow tract obstruction due to common atrioventricular valve
448309008,Right ventricular outflow tract obstruction due to fibromuscular shelf
448310003,Right ventricular outflow tract obstruction due to malaligned outlet septum
448320008,Divided left atrium with some pulmonary veins to proximal chamber
448321007,Complete obstruction of cardiac conduit
448326002,Right inferior vena cava connecting to left atrium and right atrium
448328001,Aneurysm of aortic sinus of Valsalva without rupture
448329009,Aneurysm of left superior vena cava
448330004,Aneurysm of muscular septum
448331000,Atrioventricular septal defect with restrictive ventricular component
448332007,Left superior vena cava persisting to right sided atrium
448356006,Coronary sinus drainage cephalad to right superior vena cava
448357002,Midline anterior apex of heart
448413002,Pulmonary valve overriding ventricular septum
448414008,Restrictive interatrial communication
448415009,Subaortic stenosis due to common atrioventricular valve
448471006,Congenital abnormality of ascending aorta
448472004,Congenital abnormality of pulmonary trunk
448475002,Absent pulmonary valve syndrome with ventricular septal defect of non Fallot type
448476001,Subpulmonary stenosis
448477005,Superior to inferior ventricular relationship
448478000,Systemic to pulmonary collateral artery from coronary artery
448479008,Ductus arteriosus from brachiocephalic artery
448480006,Ductus arteriosus from left subclavian artery
448486000,Anomalous pulmonary to systemic collateral vein
448487009,Anomalous pulmonary venous connection of mixed type
448497000,Congenital deformity of mitral valve annulus
448499002,Infracardiac location of anomalous pulmonary venous connection
448500006,Intracardiac location of anomalous pulmonary venous connection
448501005,Interrupted left inferior vena cava
448510002,Stenosis of left pulmonary artery
448516008,Double outlet right ventricle with doubly committed ventricular septal defect and pulmonary stenosis
448517004,Vascular ring with left aortic arch and retroesophageal right descending aorta and right arterial duct arising from aortic diverticulum and aberrant right subclavian artery
448528000,Aneurysm of aortic sinus of Valsalva with rupture to pericardial cavity
448530003,Partial obstruction of cardiac conduit
448574001,Unipartite right ventricle
448575000,Fenestrated interatrial communication within oval fossa
448576004,Fenestration of aortic valve cusp
448577008,Muscular subvalvar atresia of aorta
448595006,Scimitar syndrome with additional anomalous pulmonary venous connection
448599000,Total anomalous pulmonary venous connection of infracardiac type
448604006,Congenital abnormality of pulmonary valve cusp
448611005,Vascular ring with left aortic arch and retrotracheal right patent arterial duct
448612003,Single ventricular outlet above both ventricles
448614002,Inferior vena cava anterior and same side as descending aorta
448618004,Abnormality of mitral valve annulus
448619007,Anterior deviation of infundibular septum of Fallot type
448620001,Azygos continuation of inferior vena cava to right superior vena cava
448622009,Complete obstruction of systemic to pulmonary artery shunt
448624005,Uniatrial biventricular connection with absent left sided atrioventricular connection with straddling valve
448625006,Univentricular atrioventricular connection with absent left sided atrioventricular connection
448626007,Gelatinous atrioventricular valve leaflet in atrioventricular septal defect
448627003,Vascular ring with left aortic arch and right arterial duct arising from aberrant retroesophageal brachiocephalic artery
448628008,Vascular ring with left aortic arch and right arterial duct arising from retroesophageal aortic diverticulum and aberrant right subclavian artery
448629000,Vascular ring with left aortic arch and right arterial ligament
448630005,Vascular ring with left aortic arch and right patent arterial duct
448631009,Right inferior vena cava connecting to left sided atrium
448632002,Left inferior vena cava connecting to left atrium and right atrium
448633007,Right ventricular outflow tract obstruction due to atrioventricular valve
448634001,Absent aortic valve cusp
448635000,Absent ductus venosus
448637008,Coarctation of left pulmonary artery
448643005,Abnormality of pulmonary valve
448644004,Abnormality of right inferior vena cava
448645003,Aortic arch hypoplasia between subclavian and common carotid arteries
448646002,Aortic arch hypoplasia distal to subclavian artery
448651008,Partial obstruction of systemic to pulmonary artery shunt
448681000,Indeterminate atrial arrangement
448682007,Thickened atrial septum
448684008,Prolapse of left coronary aortic valve cusp
448721009,Abnormal course of aortic arch and descending aorta
448722002,Abnormality of abdominal aorta
448723007,Aneurysm of aortic sinus of Valsalva with rupture to left atrium
448724001,Aneurysm of aortic sinus of Valsalva with rupture to left ventricle
448726004,Parallel course of aorta and pulmonary artery
448727008,Total anomalous pulmonary venous connections of mixed type
448728003,Supracardiac location of anomalous pulmonary venous connection
448729006,Common atrioventricular valve in functionally univentricular heart
448742006,Abnormality of aortic arch
448743001,Abnormality of aortic valve
448744007,Aneurysm of aortic sinus of Valsalva with rupture to pulmonary artery
448745008,Aneurysm of aortic sinus of Valsalva with rupture to right atrium
448746009,Aneurysm of aortic sinus of Valsalva with rupture to right ventricle
448747000,Common arterial trunk with pulmonary origin from truncal valve sinus
448777006,Noncoapting atrioventricular valve leaflet in atrioventricular septal defect
448778001,Obstruction of right ventricular outflow tract due to aortico-left ventricular tunnel
448780007,Ventricular septal defect with absent outlet septum and overriding truncal valve with extension of membranous septum
448782004,Interrupted right inferior vena cava
448783009,Pulmonary vein dilatation
