icd10_code,icd10_description,snomed_conceptId,snomed_term,read2_code,read2_term
,,237594007,Abnormality of serotonin secretion (disorder),,
,,237595008,Abnormality of neurotensine secretion (disorder),,
,,237786003,Gynecological endocrinology disorder (disorder),,
,,237806007,Androgen receptor absent (disorder),,
,,237810005,Feminization due to tumor (disorder),,
,,237822008,Autoimmune endocrine disease (disorder),,
,,237839005,Growth hormone receptor abnormality (disorder),,
,,238870004,Hutchinson-Gilford syndrome (disorder),,
,,238874008,Neonatal pseudo-hydrocephalic progeroid syndrome (disorder),,
,,276856001,Endocrine andrology disorder (disorder),,
,,399959003,Premature aging syndrome (disorder),,
,,408539000,Insulin autoimmune syndrome (disorder),,
,,413099000,Cyst of pineal gland (disorder),,
,,442498002,Endocrine axis dysfunction (disorder),,
,,715633008,Atypical Werner syndrome (disorder),,
,,722288007,Autoimmune enteropathy and endocrinopathy with susceptibility to chronic infection syndrome (disorder),,
,,770567006,Progeroid syndrome Petty type (disorder),,
,,771262009,Pseudoleprechaunism syndrome Patterson type (disorder),,
,,773331001,Nestor Guillermo progeria syndrome (disorder),,
,,773406003,"Mandibular hypoplasia, deafness, progeroid syndrome (disorder)",,
,,773426004,Lamin A/C related cardiocutaneous progeria syndrome (disorder),,
,,773666007,Hypoinsulinemic hypoglycemia and body hemihypertrophy (disorder),,
,,776417008,"Acroosteolysis, keloid-like lesions, premature aging syndrome (disorder)",,
,,26935004,Tuberculosis of thyroid gland (disorder),,
,,24867002,Severe adrenal insufficiency (disorder),,
,,766986002,Acute adrenal insufficiency (disorder),,
