code,description
234519006,Bone marrow transplant rejection (disorder)
234520000,Bone marrow transplant failure (disorder)
234522008,Disease relapse in transplant marrow (disorder)
234646005,Graft-versus-host disease (disorder)
402355000,Acute graft-versus-host disease (disorder)
402356004,Chronic graft-versus-host disease (disorder)
402358003,Sclerodermoid chronic graft-versus-host disease (disorder)
402359006,Toxic epidermal necrolysis due to graft-versus-host disease (disorder)
402361002,Nail dystrophy due to graft-versus-host disease (disorder)
402362009,Oral mucosal disease due to graft-versus-host disease (disorder)
431456004,Accelerated rejection of bone marrow transplant (disorder)
431862001,Acute rejection of bone marrow transplant (disorder)
431953002,Chronic rejection of bone marrow transplant (disorder)
432782005,Hyperacute rejection of bone marrow transplant (disorder)
846606007,Graft versus host disease of liver (disorder)
870351002,Non-infective enteritis due to graft-versus-host disease (disorder)
871633002,Ulcer of intestine due to graft-versus-host disease (disorder)
1.21E+14,Chronic graft versus host disease after transplantation of bone marrow (disorder)
58797008,Complication of transplanted kidney (disorder)
213150003,Kidney transplant failure and rejection (disorder)
236569000,Primary non-function of renal transplant (disorder)
236570004,Renal transplant rejection (disorder)
236571000,Hyperacute rejection of renal transplant (disorder)
236572007,Accelerated rejection of renal transplant (disorder)
236573002,Very mild acute rejection of renal transplant (disorder)
236574008,Acute rejection of renal transplant (disorder)
236575009,Acute rejection of renal transplant - grade I (disorder)
236576005,Acute rejection of renal transplant - grade II (disorder)
236577001,Acute rejection of renal transplant - grade III (disorder)
236578006,Chronic rejection of renal transplant (disorder)
236579003,Chronic rejection of renal transplant - grade I (disorder)
236580000,Chronic rejection of renal transplant - grade II (disorder)
236581001,Chronic rejection of renal transplant - grade III (disorder)
236582008,Acute-on-chronic rejection of renal transplant (disorder)
236583003,Failed renal transplant (disorder)
236585005,De novo transplant disease (disorder)
236587002,Transplant glomerulopathy (disorder)
236588007,Transplant glomerulopathy - early form (disorder)
236589004,Transplant glomerulopathy - late form (disorder)
236614007,Perirenal and periureteric post-transplant lymphocele (disorder)
277010001,Unexplained episode of renal transplant dysfunction (disorder)
277011002,Pre-existing disease in renal transplant (disorder)
426136000,Delayed renal graft function (disorder)
213151004,Heart transplant failure and rejection (disorder)
233933006,Cardiac transplant rejection (disorder)
233934000,Cardiac transplant failure (disorder)
429257001,Disorder of transplanted heart (disorder)
431186002,Accelerated rejection of cardiac transplant (disorder)
431896008,Chronic rejection of cardiac transplant (disorder)
432773004,Hyperacute rejection of cardiac transplant (disorder)
432843002,Acute rejection of cardiac transplant (disorder)
471851005,Disorder of myocardium associated with rejection of cardiac transplant (disorder)
213152006,Heart-lung transplant failure and rejection (disorder)
33167004,Complication of transplanted liver (disorder)
213153001,Liver transplant failure and rejection (disorder)
235910007,Liver transplant disorder (disorder)
235911006,Liver transplant rejection (disorder)
235912004,Liver transplant failure (disorder)
431222008,Acute rejection of liver transplant (disorder)
432772009,Hyperacute rejection of liver transplant (disorder)
432777003,Accelerated rejection of liver transplant (disorder)
432908002,Chronic rejection of liver transplant (disorder)
8729004,Chronic graft rejection (finding)
13160009,Complication of transplanted intestines (disorder)
22391002,Mechanical complication due to skin graft failure AND/OR rejection (disorder)
23991000,Chronic active graft rejection (finding)
24458006,Primary graft failure (finding)
26522000,Hyperacute graft rejection (finding)
35006009,Graft failure due to recurrent recipient disease (finding)
35390002,Chronic inactive graft rejection (finding)
40442005,Acute cellular graft rejection (finding)
41267003,Graft failure due to stenosis (finding)
44165003,Complication of transplanted lung (disorder)
50662000,Mild cellular graft rejection (finding)
73863006,Graft failure due to acute tubular necrosis (finding)
79369007,Complication of transplanted pancreas (disorder)
85863004,Graft failure due to thrombosis (finding)
86825002,Chronic arterial allograft rejection (finding)
95742008,Corneal graft rejection (disorder)
112140009,Moderate cellular graft rejection (finding)
213088004,Rejection of bone allograft (disorder)
213192008,Skin graft failure (disorder)
213193003,Flap failure (disorder)
213195005,Bone graft failure (disorder)
213198007,Disruption of vessel repair (disorder)
233634002,Post-lung transplantation bronchiectasis (disorder)
234079009,Rupture of transplanted vein (disorder)
239182004,Skin graft hematoma (disorder)
239183009,Skin graft seroma (disorder)
239185002,Skin graft displaced (disorder)
239195009,Flap disorder (disorder)
239196005,Flap loss (disorder)
239197001,Full thickness flap loss (disorder)
239198006,Partial thickness flap loss (disorder)
239199003,Complete flap loss (disorder)
239208007,Anastomotic failure of flap (disorder)
246972003,Graft rejection line (finding)
271990007,Vascular graft avulsion (disorder)
281434003,Failure of cartilage graft (disorder)
281435002,Rejection of bone graft (disorder)
307210003,Nonunion of bone graft (disorder)
312603000,Lung transplant rejection (disorder)
314002005,Corneal allograft rejection (disorder)
403680004,Skin graft necrosis (disorder)
403681000,Skin graft hypertrophy (disorder)
420505005,Corneal endothelial allograft rejection (disorder)
420571002,Corneal subepithelial allograft rejection (disorder)
421187003,Corneal epithelial allograft rejection (disorder)
426768001,Engraftment syndrome (disorder)
431223003,Acute rejection of lung transplant (disorder)
431505005,Rejection of intestine transplant (disorder)
431506006,Rejection of pancreas transplant (disorder)
431507002,Accelerated rejection of lung transplant (disorder)
432265007,Rejection of corneal graft after penetrating keratoplasty (disorder)
432774005,Hyperacute rejection of lung transplant (disorder)
432958009,Chronic rejection of lung transplant (disorder)
433087001,Primary failure of corneal graft after penetrating keratoplasty (disorder)
433592008,Acute rejection of pancreas transplant (disorder)
433600001,Hyperacute rejection of intestine transplant (disorder)
433804007,Accelerated rejection of intestine transplant (disorder)
433809002,Accelerated rejection of pancreas transplant (disorder)
434202008,Hyperacute rejection of pancreas transplant (disorder)
434238001,Acute rejection of intestine transplant (disorder)
434270001,Chronic rejection of intestine transplant (disorder)
434271002,Chronic rejection of pancreas transplant (disorder)
439915009,Complication of artificial skin graft and decellularized allodermis (disorder)
440367008,Complication of artificial skin graft (disorder)
444547006,Graft versus host disease of skin (disorder)
698085003,Mechanical complication of tissue graft (disorder)
714176002,Necrosis of flap (disorder)
1.61E+16,Transplant rejection of cornea of left eye (disorder)
1.61E+16,Transplant failure of cornea of right eye (disorder)
1.61E+16,Transplant rejection of cornea of right eye (disorder)
1.61E+16,Transplant failure of cornea of left eye (disorder)
9950006,Graft failure due to prolonged ischemia (finding)
25317007,Graft failure due to anastomotic leak (finding)
47650006,Graft versus host reaction (finding)
72627004,Graft rejection (finding)
89842009,Sloughed graft (finding)
197747000,Renal tubulo-interstitial disorders in transplant rejection (disorder)
213148006,Transplanted organ rejection (disorder)
269295009,Transplanted organ failure (disorder)
445964006,Monomorphic posttransplant lymphoproliferative disorder (disorder)
705154007,Acute vascular graft rejection (finding)
733208006,Composite graft failure (disorder)
161665007,History of renal transplant (situation)
236436003,End stage renal failure with renal transplant (disorder)
236584009,Perfusion injury of renal transplant (disorder)
236586006,De novo glomerulonephritis (disorder)
428575007,Hypertension secondary to kidney transplant (disorder)
703048006,Vesicoureteric reflux after renal transplant (disorder)
714153000,Chronic kidney disease stage 5 with transplant (disorder)
737295003,Transplanted kidney present (finding)
161666008,History of heart recipient (situation)
161681002,History of artificial heart (situation)
233844002,Accelerated coronary artery disease in transplanted heart (disorder)
444855007,Arteriosclerosis of coronary artery bypass graft of transplanted heart (disorder)
739024006,Transplanted heart present (finding)
792842004,Coronary arteriosclerosis in artery of transplanted heart (disorder)
161672008,History of being lung transplant recipient (situation)
737296002,Transplanted lung present (finding)
739025007,Transplanted heart-lung present (finding)
784266000,History of heart-lung transplant recipient (situation)
161671001,History of liver recipient (situation)
737297006,Transplanted liver present (finding)
161668009,History of skin recipient (situation)
733207001,Necrosis of myocutaneous flap (disorder)
739027004,Transplanted skin present (finding)
161669001,History of bone tissue recipient (situation)
737298001,Transplanted bone present (finding)
161670000,History of cornea recipient (situation)
314556009,Healthy corneal graft (finding)
424960002,Penetrating keratoplasty graft in place (finding)
427435004,Punctate keratopathy after penetrating keratoplasty (disorder)
698427001,History of grafting of corneal patch to eye (situation)
737299009,Transplanted cornea present (finding)
8.60E+13,History of penetrating keratoplasty (situation)
1.57E+16,History of Descemet's membrane endothelial keratoplasty (situation)
161674009,History of artificial organ or tissue (situation)
236610003,Escape of urine from transplanted ureter (disorder)
262945004,Transection of transplanted artery (disorder)
262947007,Aneurysm of transplanted vein (disorder)
429362002,Short stature associated with bone marrow transplant (disorder)
698362007,History of transplantation of pancreas (situation)
698367001,History of transplantation of intestine (situation)
698426005,History of grafting of amniotic membrane to eye (situation)
737300001,Bone marrow transplant present (finding)
2.63E+12,History of bone marrow transplant (situation)
8.73E+13,History of hair transplant (situation)
1.09E+14,History of autologous bone marrow transplant (situation)
1.22E+14,Lymphoproliferative disorder after transplantation of bone marrow (disorder)
1.37E+14,History of allotransplantation of meniscus (situation)
1.53E+14,History of allotransplantation of bone marrow (situation)
1.53E+14,History of peripheral stem cell transplant (situation)
2.94E+14,History of islet cell transplant (situation)
161663000,History of being a tissue or organ recipient (situation)
183655000,Transplant follow-up (finding)
254289008,Post-transplant neoplasia (disorder)
254290004,Lymphoproliferative disorder following transplantation (disorder)
427889009,Hypertension associated with transplantation (disorder)
445261005,Posttransplant hyperlipidemia (disorder)
720587009,Donor derived melanoma (disorder)
722956007,Early post-transplant lymphoproliferative disorder (disorder)
722957003,Reactive plasmacytic hyperplasia post-transplant lymphoproliferative disorder (disorder)
722958008,Infectious mononucleosis-like post-transplant lymphoproliferative disorder (disorder)
737294004,Transplant present (finding)
762316003,Polymorphic lymphoproliferative disorder following transplant (disorder)
213180008,Total failure replanted forearm (disorder)
